{
  "id": "D58",
  "name": "Volume Climax & Distribution Signs",
  "artifact_type": "diagnostic",
  "version": "1.0.0",
  "status": "REVIEW_REQUIRED",
  "effective_from": null,
  "supersedes": [],
  "legacy_repository": "Hybrid-Stock-Intelligence",
  "legacy_commit": "f88b44d514fc9a2654040aa04e5350fc9e8660fe",
  "legacy_sources": [
    {
      "path": "app/registry/canonical.py",
      "symbol_or_heading": "DIAGNOSTIC_RULES",
      "authority": "LATEST_ACCEPTED_WITH_LIMITATIONS",
      "source_role": "CONTRACT"
    },
    {
      "path": "app/diagnostics/evaluators.py",
      "symbol_or_heading": "DeterministicDiagnosticEvaluators.volume_climax",
      "authority": "LATEST_ACCEPTED_WITH_LIMITATIONS",
      "source_role": "IMPLEMENTATION"
    },
    {
      "path": "docs/architecture/DIAGNOSTIC_61_OPERATIONAL_COVERAGE_V1.json",
      "symbol_or_heading": "records[rule_id=58]",
      "authority": "LATEST_ACCEPTED_WITH_LIMITATIONS",
      "source_role": "AUDIT"
    }
  ],
  "authority_status": "LATEST_ACCEPTED_WITH_LIMITATIONS",
  "extraction_status": "VERIFIED",
  "review_status": "IN_REVIEW",
  "calculation_owner": null,
  "evidence_dependencies": [
    "rvol",
    "volume_climax"
  ],
  "known_limitations": [
    "3 daily observations",
    "No Lite evaluator or calculation runtime; current-descriptive legacy coverage is not production/PIT readiness.",
    "Legacy rule-level gate criticality is not separately designated; NON_CRITICAL means no direct gate authority here.",
    "Legacy DUPLICATE_COMPUTATION: Yes, independent RVOL formula. Future Lite consumes normalized rvol, volume_climax; the repeated upstream calculation is removed from diagnostic responsibility."
  ],
  "conflicts": [],
  "notes": "Legacy V1 diagnostic-registry-v1. Audited metric: RVOL, range, close location. Coverage input: Daily price and volume. Legacy audit class: DUPLICATE_COMPUTATION. Lite interpretation: One normalized RVOL definition, then climax-specific check. Legacy evaluation mode: HYBRID. Legacy operational state: OPERATIONAL_CURRENT_DESCRIPTIVE. No thresholds, direct score, gates, strategy or order authority migrated.",
  "deterministic_computation": false,
  "details": {
    "diagnostic_id": "D58",
    "canonical_name": "Volume Climax & Distribution Signs",
    "version": "1.0.0",
    "authority": "LATEST_ACCEPTED_WITH_LIMITATIONS",
    "lifecycle": "REVIEW_REQUIRED",
    "evidence_dependencies": [
      "rvol",
      "volume_climax"
    ],
    "evaluation_type": "COMPOSITE_RECONCILIATION",
    "result_semantics": {
      "PASS": "Only an accepted V1 result confirming RVOL, range, close location from certified inputs may be PASS; no threshold is defined by this artifact.",
      "CAUTION": "No direct V1 CAUTION status exists; a future reviewed mapping of V1 NEUTRAL or mixed Volume climax evidence is required. Missing input is not CAUTION.",
      "FAIL": "Only an accepted V1 result finding adverse RVOL, range, close location from certified inputs may be FAIL; no threshold is defined by this artifact.",
      "UNKNOWN": "V1 INSUFFICIENT_DATA or UNVERIFIED for missing, stale, noncomparable, conflicting or unsupported RVOL, range, close location; never PASS."
    },
    "criticality": "NON_CRITICAL",
    "score_relationship": "Legacy coverage audit references optional:smart_money_evidence, optional:volume_obv_vwap; no Lite score computed.",
    "gate_relationship": "Six gates are independent governed consumers; this diagnostic cannot override a gate or authorize execution.",
    "strategy_relationship": "May inform a separately approved future strategy; this diagnostic alone never creates setup, trade, BUY or SELL.",
    "provenance": [
      "app/registry/canonical.py#DIAGNOSTIC_RULES",
      "app/diagnostics/evaluators.py#DeterministicDiagnosticEvaluators.volume_climax",
      "docs/architecture/DIAGNOSTIC_61_OPERATIONAL_COVERAGE_V1.json#records[rule_id=58]"
    ],
    "limitations": [
      "3 daily observations",
      "No Lite evaluator or calculation runtime; current-descriptive legacy coverage is not production/PIT readiness.",
      "Legacy rule-level gate criticality is not separately designated; NON_CRITICAL means no direct gate authority here.",
      "Legacy DUPLICATE_COMPUTATION: Yes, independent RVOL formula. Future Lite consumes normalized rvol, volume_climax; the repeated upstream calculation is removed from diagnostic responsibility."
    ]
  }
}
