{
  "id": "D50",
  "name": "Institutional Accumulation vs Distribution Proxy",
  "artifact_type": "diagnostic",
  "version": "1.0.0",
  "status": "REVIEW_REQUIRED",
  "effective_from": null,
  "supersedes": [],
  "legacy_repository": "Hybrid-Stock-Intelligence",
  "legacy_commit": "f88b44d514fc9a2654040aa04e5350fc9e8660fe",
  "legacy_sources": [
    {
      "path": "app/registry/canonical.py",
      "symbol_or_heading": "DIAGNOSTIC_RULES",
      "authority": "LATEST_ACCEPTED_WITH_LIMITATIONS",
      "source_role": "CONTRACT"
    },
    {
      "path": "app/diagnostics/evaluators.py",
      "symbol_or_heading": "DeterministicDiagnosticEvaluators.accumulation_distribution_proxy",
      "authority": "LATEST_ACCEPTED_WITH_LIMITATIONS",
      "source_role": "IMPLEMENTATION"
    },
    {
      "path": "docs/architecture/DIAGNOSTIC_61_OPERATIONAL_COVERAGE_V1.json",
      "symbol_or_heading": "records[rule_id=50]",
      "authority": "LATEST_ACCEPTED_WITH_LIMITATIONS",
      "source_role": "AUDIT"
    }
  ],
  "authority_status": "LATEST_ACCEPTED_WITH_LIMITATIONS",
  "extraction_status": "VERIFIED",
  "review_status": "IN_REVIEW",
  "calculation_owner": null,
  "evidence_dependencies": [
    "accumulation_distribution",
    "liquidity_events",
    "wyckoff_phase"
  ],
  "known_limitations": [
    "Not observed institutional ownership",
    "No Lite evaluator or calculation runtime; current-descriptive legacy coverage is not production/PIT readiness.",
    "Legacy rule-level gate criticality is not separately designated; NON_CRITICAL means no direct gate authority here.",
    "Legacy DUPLICATE_COMPUTATION: Yes; Wyckoff calls events again. Future Lite consumes normalized accumulation_distribution, liquidity_events, wyckoff_phase; the repeated upstream calculation is removed from diagnostic responsibility."
  ],
  "conflicts": [],
  "notes": "Legacy V1 diagnostic-registry-v1. Audited metric: Price, events, Wyckoff proxy. Coverage input: OHLCV location/participation. Legacy audit class: DUPLICATE_COMPUTATION. Lite interpretation: Reuse normalized event/phase outputs; no institutional-flow claim. Legacy evaluation mode: HYBRID. Legacy operational state: OPERATIONAL_CURRENT_DESCRIPTIVE. No thresholds, direct score, gates, strategy or order authority migrated.",
  "deterministic_computation": false,
  "details": {
    "diagnostic_id": "D50",
    "canonical_name": "Institutional Accumulation vs Distribution Proxy",
    "version": "1.0.0",
    "authority": "LATEST_ACCEPTED_WITH_LIMITATIONS",
    "lifecycle": "REVIEW_REQUIRED",
    "evidence_dependencies": [
      "accumulation_distribution",
      "liquidity_events",
      "wyckoff_phase"
    ],
    "evaluation_type": "COMPOSITE_RECONCILIATION",
    "result_semantics": {
      "PASS": "Only an accepted V1 result confirming Price, events, Wyckoff proxy from certified inputs may be PASS; no threshold is defined by this artifact.",
      "CAUTION": "No direct V1 CAUTION status exists; a future reviewed mapping of V1 NEUTRAL or mixed Accumulation/distribution evidence is required. Missing input is not CAUTION.",
      "FAIL": "Only an accepted V1 result finding adverse Price, events, Wyckoff proxy from certified inputs may be FAIL; no threshold is defined by this artifact.",
      "UNKNOWN": "V1 INSUFFICIENT_DATA or UNVERIFIED for missing, stale, noncomparable, conflicting or unsupported Price, events, Wyckoff proxy; never PASS."
    },
    "criticality": "NON_CRITICAL",
    "score_relationship": "Legacy coverage audit references optional:smart_money_evidence; no Lite score computed.",
    "gate_relationship": "Six gates are independent governed consumers; this diagnostic cannot override a gate or authorize execution.",
    "strategy_relationship": "May inform a separately approved future strategy; this diagnostic alone never creates setup, trade, BUY or SELL.",
    "provenance": [
      "app/registry/canonical.py#DIAGNOSTIC_RULES",
      "app/diagnostics/evaluators.py#DeterministicDiagnosticEvaluators.accumulation_distribution_proxy",
      "docs/architecture/DIAGNOSTIC_61_OPERATIONAL_COVERAGE_V1.json#records[rule_id=50]"
    ],
    "limitations": [
      "Not observed institutional ownership",
      "No Lite evaluator or calculation runtime; current-descriptive legacy coverage is not production/PIT readiness.",
      "Legacy rule-level gate criticality is not separately designated; NON_CRITICAL means no direct gate authority here.",
      "Legacy DUPLICATE_COMPUTATION: Yes; Wyckoff calls events again. Future Lite consumes normalized accumulation_distribution, liquidity_events, wyckoff_phase; the repeated upstream calculation is removed from diagnostic responsibility."
    ]
  }
}
