{
  "id": "evidence_discipline",
  "name": "Evidence discipline",
  "artifact_type": "governance_policy",
  "version": "0.1.0",
  "status": "REVIEW_REQUIRED",
  "effective_from": null,
  "supersedes": [],
  "legacy_repository": "Hybrid-Stock-Intelligence",
  "legacy_commit": "f88b44d514fc9a2654040aa04e5350fc9e8660fe",
  "legacy_sources": [
    {"path": "docs/architecture/brain_contract.md", "symbol_or_heading": "Brain Contract", "authority": "AUTHORITATIVE_ACCEPTED", "source_role": "CONTRACT"},
    {"path": "docs/CLAIM_MODEL.md", "symbol_or_heading": "Claim model", "authority": "AUTHORITATIVE_ACCEPTED", "source_role": "CONTRACT"}
  ],
  "authority_status": "AUTHORITATIVE_ACCEPTED",
  "extraction_status": "VERIFIED",
  "review_status": "IN_REVIEW",
  "calculation_owner": null,
  "evidence_dependencies": [],
  "known_limitations": ["This policy describes evidence semantics; it does not certify any source or runtime fact."],
  "conflicts": [],
  "notes": "Task #004 governance extraction only; no diagnostic or runtime implementation.",
  "deterministic_computation": false,
  "details": {
    "evidence_chain": ["FACT", "DATA", "INTERPRETATION", "INFERENCE"],
    "fact_and_data_distinct_from_interpretation": true,
    "inference_can_be_source_fact": false,
    "missing_evidence_outcome": "UNKNOWN_OR_UNAVAILABLE",
    "missing_evidence_can_mean_zero": false,
    "missing_evidence_can_mean_neutral": false,
    "missing_evidence_can_mean_pass": false,
    "unsupported_confidence_allowed": false,
    "runtime_consumer": "Future evidence normalization and diagnostic eligibility",
    "direct_trade_authority": false
  }
}
