{
  "id": "D34",
  "name": "Bull / Base / Bear Probability Scenarios",
  "artifact_type": "diagnostic",
  "version": "1.0.0",
  "status": "REVIEW_REQUIRED",
  "effective_from": null,
  "supersedes": [],
  "legacy_repository": "Hybrid-Stock-Intelligence",
  "legacy_commit": "f88b44d514fc9a2654040aa04e5350fc9e8660fe",
  "legacy_sources": [
    {
      "path": "app/registry/canonical.py",
      "symbol_or_heading": "DIAGNOSTIC_RULES",
      "authority": "LATEST_ACCEPTED_WITH_LIMITATIONS",
      "source_role": "CONTRACT"
    },
    {
      "path": "app/diagnostics/evaluators.py",
      "symbol_or_heading": "DeterministicDiagnosticEvaluators.scenarios",
      "authority": "LATEST_ACCEPTED_WITH_LIMITATIONS",
      "source_role": "IMPLEMENTATION"
    },
    {
      "path": "docs/architecture/DIAGNOSTIC_61_OPERATIONAL_COVERAGE_V1.json",
      "symbol_or_heading": "records[rule_id=34]",
      "authority": "LATEST_ACCEPTED_WITH_LIMITATIONS",
      "source_role": "AUDIT"
    }
  ],
  "authority_status": "LATEST_ACCEPTED_WITH_LIMITATIONS",
  "extraction_status": "VERIFIED",
  "review_status": "IN_REVIEW",
  "calculation_owner": null,
  "evidence_dependencies": [
    "diagnostic_results"
  ],
  "known_limitations": [
    "No newly calibrated probabilities",
    "No Lite evaluator or calculation runtime; current-descriptive legacy coverage is not production/PIT readiness.",
    "Legacy rule-level gate criticality is not separately designated; NON_CRITICAL means no direct gate authority here."
  ],
  "conflicts": [],
  "notes": "Legacy V1 diagnostic-registry-v1. Audited metric: Rules 31/32/33. Coverage input: Eligible 31/32/33. Legacy audit class: JUSTIFIED_UNIQUE_CHECK. Lite interpretation: Preserve qualitative/ordinal scenario limits. Legacy evaluation mode: INTERPRETIVE. Legacy operational state: PARTIAL. No thresholds, direct score, gates, strategy or order authority migrated.",
  "deterministic_computation": false,
  "details": {
    "diagnostic_id": "D34",
    "canonical_name": "Bull / Base / Bear Probability Scenarios",
    "version": "1.0.0",
    "authority": "LATEST_ACCEPTED_WITH_LIMITATIONS",
    "lifecycle": "REVIEW_REQUIRED",
    "evidence_dependencies": [
      "diagnostic_results"
    ],
    "evaluation_type": "JUSTIFIED_UNIQUE_CHECK",
    "result_semantics": {
      "PASS": "Only an accepted V1 result confirming Rules 31/32/33 from certified inputs may be PASS; no threshold is defined by this artifact.",
      "CAUTION": "No direct V1 CAUTION status exists; a future reviewed mapping of V1 NEUTRAL or mixed Bull/base/bear scenarios evidence is required. Missing input is not CAUTION.",
      "FAIL": "Only an accepted V1 result finding adverse Rules 31/32/33 from certified inputs may be FAIL; no threshold is defined by this artifact.",
      "UNKNOWN": "V1 INSUFFICIENT_DATA or UNVERIFIED for missing, stale, noncomparable, conflicting or unsupported Rules 31/32/33; never PASS."
    },
    "criticality": "NON_CRITICAL",
    "score_relationship": "No direct score component established by this extraction; no Lite score computed.",
    "gate_relationship": "Six gates are independent governed consumers; this diagnostic cannot override a gate or authorize execution.",
    "strategy_relationship": "May inform a separately approved future strategy; this diagnostic alone never creates setup, trade, BUY or SELL.",
    "provenance": [
      "app/registry/canonical.py#DIAGNOSTIC_RULES",
      "app/diagnostics/evaluators.py#DeterministicDiagnosticEvaluators.scenarios",
      "docs/architecture/DIAGNOSTIC_61_OPERATIONAL_COVERAGE_V1.json#records[rule_id=34]"
    ],
    "limitations": [
      "No newly calibrated probabilities",
      "No Lite evaluator or calculation runtime; current-descriptive legacy coverage is not production/PIT readiness.",
      "Legacy rule-level gate criticality is not separately designated; NON_CRITICAL means no direct gate authority here."
    ]
  }
}
