{
  "id": "D21",
  "name": "Ownership Structure — Promoter Holding & Pledge",
  "artifact_type": "diagnostic",
  "version": "1.0.0",
  "status": "REVIEW_REQUIRED",
  "effective_from": null,
  "supersedes": [],
  "legacy_repository": "Hybrid-Stock-Intelligence",
  "legacy_commit": "f88b44d514fc9a2654040aa04e5350fc9e8660fe",
  "legacy_sources": [
    {
      "path": "app/registry/canonical.py",
      "symbol_or_heading": "DIAGNOSTIC_RULES",
      "authority": "LATEST_ACCEPTED_WITH_LIMITATIONS",
      "source_role": "CONTRACT"
    },
    {
      "path": "app/diagnostics/evaluators.py",
      "symbol_or_heading": "DeterministicDiagnosticEvaluators.ownership",
      "authority": "LATEST_ACCEPTED_WITH_LIMITATIONS",
      "source_role": "IMPLEMENTATION"
    },
    {
      "path": "docs/architecture/DIAGNOSTIC_61_OPERATIONAL_COVERAGE_V1.json",
      "symbol_or_heading": "records[rule_id=21]",
      "authority": "LATEST_ACCEPTED_WITH_LIMITATIONS",
      "source_role": "AUDIT"
    }
  ],
  "authority_status": "LATEST_ACCEPTED_WITH_LIMITATIONS",
  "extraction_status": "VERIFIED",
  "review_status": "IN_REVIEW",
  "calculation_owner": null,
  "evidence_dependencies": [
    "ownership"
  ],
  "known_limitations": [
    "One reporting period is not a holding shift",
    "No Lite evaluator or calculation runtime; current-descriptive legacy coverage is not production/PIT readiness.",
    "Legacy rule-level gate criticality is not separately designated; NON_CRITICAL means no direct gate authority here.",
    "Financial comparability required: preserve period basis, scale, denominator and source; missing CAPEX or other inputs are not zero/default."
  ],
  "conflicts": [],
  "notes": "Legacy V1 diagnostic-registry-v1. Audited metric: Comparable promoter/pledge periods. Coverage input: 2 comparable promoter holding/pledge periods. Legacy audit class: PURE_CONSUMER. Lite interpretation: Normalize official dated ownership, then diagnose shift. Legacy evaluation mode: HYBRID. Legacy operational state: NOT_READY. No thresholds, direct score, gates, strategy or order authority migrated.",
  "deterministic_computation": false,
  "details": {
    "diagnostic_id": "D21",
    "canonical_name": "Ownership Structure — Promoter Holding & Pledge",
    "version": "1.0.0",
    "authority": "LATEST_ACCEPTED_WITH_LIMITATIONS",
    "lifecycle": "REVIEW_REQUIRED",
    "evidence_dependencies": [
      "ownership"
    ],
    "evaluation_type": "PURE_CONSUMER",
    "result_semantics": {
      "PASS": "Only an accepted V1 result confirming Comparable promoter/pledge periods from certified inputs may be PASS; no threshold is defined by this artifact.",
      "CAUTION": "No direct V1 CAUTION status exists; a future reviewed mapping of V1 NEUTRAL or mixed Ownership evidence is required. Missing input is not CAUTION.",
      "FAIL": "Only an accepted V1 result finding adverse Comparable promoter/pledge periods from certified inputs may be FAIL; no threshold is defined by this artifact.",
      "UNKNOWN": "V1 INSUFFICIENT_DATA or UNVERIFIED for missing, stale, noncomparable, conflicting or unsupported Comparable promoter/pledge periods; never PASS."
    },
    "criticality": "NON_CRITICAL",
    "score_relationship": "No direct score component established by this extraction; no Lite score computed.",
    "gate_relationship": "Six gates are independent governed consumers; this diagnostic cannot override a gate or authorize execution.",
    "strategy_relationship": "May inform a separately approved future strategy; this diagnostic alone never creates setup, trade, BUY or SELL.",
    "provenance": [
      "app/registry/canonical.py#DIAGNOSTIC_RULES",
      "app/diagnostics/evaluators.py#DeterministicDiagnosticEvaluators.ownership",
      "docs/architecture/DIAGNOSTIC_61_OPERATIONAL_COVERAGE_V1.json#records[rule_id=21]"
    ],
    "limitations": [
      "One reporting period is not a holding shift",
      "No Lite evaluator or calculation runtime; current-descriptive legacy coverage is not production/PIT readiness.",
      "Legacy rule-level gate criticality is not separately designated; NON_CRITICAL means no direct gate authority here.",
      "Financial comparability required: preserve period basis, scale, denominator and source; missing CAPEX or other inputs are not zero/default."
    ]
  }
}
