{
  "id": "D11",
  "name": "Volume Behavior & Relative Volume (RVOL)",
  "artifact_type": "diagnostic",
  "version": "1.0.0",
  "status": "REVIEW_REQUIRED",
  "effective_from": null,
  "supersedes": [],
  "legacy_repository": "Hybrid-Stock-Intelligence",
  "legacy_commit": "f88b44d514fc9a2654040aa04e5350fc9e8660fe",
  "legacy_sources": [
    {
      "path": "app/registry/canonical.py",
      "symbol_or_heading": "DIAGNOSTIC_RULES",
      "authority": "LATEST_ACCEPTED_WITH_LIMITATIONS",
      "source_role": "CONTRACT"
    },
    {
      "path": "app/diagnostics/evaluators.py",
      "symbol_or_heading": "DeterministicDiagnosticEvaluators.volume",
      "authority": "LATEST_ACCEPTED_WITH_LIMITATIONS",
      "source_role": "IMPLEMENTATION"
    },
    {
      "path": "docs/architecture/DIAGNOSTIC_61_OPERATIONAL_COVERAGE_V1.json",
      "symbol_or_heading": "records[rule_id=11]",
      "authority": "LATEST_ACCEPTED_WITH_LIMITATIONS",
      "source_role": "AUDIT"
    }
  ],
  "authority_status": "LATEST_ACCEPTED_WITH_LIMITATIONS",
  "extraction_status": "VERIFIED",
  "review_status": "IN_REVIEW",
  "calculation_owner": null,
  "evidence_dependencies": [
    "rvol"
  ],
  "known_limitations": [
    "4 daily observations",
    "No Lite evaluator or calculation runtime; current-descriptive legacy coverage is not production/PIT readiness.",
    "Legacy rule-level gate criticality is not separately designated; NON_CRITICAL means no direct gate authority here."
  ],
  "conflicts": [],
  "notes": "Legacy V1 diagnostic-registry-v1. Audited metric: Current volume versus lookback. Coverage input: RVOL and volume continuity. Legacy audit class: PURE_CONSUMER. Lite interpretation: One versioned RVOL metric. Legacy evaluation mode: DETERMINISTIC. Legacy operational state: OPERATIONAL_CURRENT_DESCRIPTIVE. No thresholds, direct score, gates, strategy or order authority migrated.",
  "deterministic_computation": false,
  "details": {
    "diagnostic_id": "D11",
    "canonical_name": "Volume Behavior & Relative Volume (RVOL)",
    "version": "1.0.0",
    "authority": "LATEST_ACCEPTED_WITH_LIMITATIONS",
    "lifecycle": "REVIEW_REQUIRED",
    "evidence_dependencies": [
      "rvol"
    ],
    "evaluation_type": "PURE_CONSUMER",
    "result_semantics": {
      "PASS": "Only an accepted V1 result confirming Current volume versus lookback from certified inputs may be PASS; no threshold is defined by this artifact.",
      "CAUTION": "No direct V1 CAUTION status exists; a future reviewed mapping of V1 NEUTRAL or mixed Relative volume evidence is required. Missing input is not CAUTION.",
      "FAIL": "Only an accepted V1 result finding adverse Current volume versus lookback from certified inputs may be FAIL; no threshold is defined by this artifact.",
      "UNKNOWN": "V1 INSUFFICIENT_DATA or UNVERIFIED for missing, stale, noncomparable, conflicting or unsupported Current volume versus lookback; never PASS."
    },
    "criticality": "NON_CRITICAL",
    "score_relationship": "Legacy coverage audit references mandatory:volume_obv_vwap; no Lite score computed.",
    "gate_relationship": "Six gates are independent governed consumers; this diagnostic cannot override a gate or authorize execution.",
    "strategy_relationship": "May inform a separately approved future strategy; this diagnostic alone never creates setup, trade, BUY or SELL.",
    "provenance": [
      "app/registry/canonical.py#DIAGNOSTIC_RULES",
      "app/diagnostics/evaluators.py#DeterministicDiagnosticEvaluators.volume",
      "docs/architecture/DIAGNOSTIC_61_OPERATIONAL_COVERAGE_V1.json#records[rule_id=11]"
    ],
    "limitations": [
      "4 daily observations",
      "No Lite evaluator or calculation runtime; current-descriptive legacy coverage is not production/PIT readiness.",
      "Legacy rule-level gate criticality is not separately designated; NON_CRITICAL means no direct gate authority here."
    ]
  }
}
